Code,"Indicator Name","Long definition","Source"
SP.DYN.LE00.IN,"Life expectancy at birth, total (years)","Life expectancy at birth indicates the number of years a newborn infant would live if prevailing patterns of mortality at the time of its birth were to stay the same throughout its life.","Derived from male and female life expectancy at birth from sources such as: (1) United Nations Population Division. World Population Prospects, (2) Census reports and other statistical publications from national statistical offices, (3) Eurostat: Demographic Statistics, (4) United Nations Statistical Division. Population and Vital Statistics Reprot (various years), (5) U.S. Census Bureau: International Database, and (6) Secretariat of the Pacific Community: Statistics and Demography Programme."
SH.XPD.PCAP,"Health expenditure per capita (current US$)","Total health expenditure is the sum of public and private health expenditures as a ratio of total population. It covers the provision of health services (preventive and curative), family planning activities, nutrition activities, and emergency aid designated for health but does not include provision of water and sanitation. Data are in current U.S. dollars.","World Health Organization Global Health Expenditure database (see http://apps.who.int/nha/database for the most recent updates)."
SH.XPD.PRIV.ZS,"Health expenditure, private (% of GDP)","Private health expenditure includes direct household (out-of-pocket) spending, private insurance, charitable donations, and direct service payments by private corporations.","World Health Organization Global Health Expenditure database (see http://apps.who.int/nha/database for the most recent updates)."
SH.XPD.PUBL.ZS,"Health expenditure, public (% of GDP)","Public health expenditure consists of recurrent and capital spending from government (central and local) budgets, external borrowings and grants (including donations from international agencies and nongovernmental organizations), and social (or compulsory) health insurance funds.","World Health Organization Global Health Expenditure database (see http://apps.who.int/nha/database for the most recent updates)."
SH.XPD.PUBL.GX.ZS,"Health expenditure, public (% of government expenditure)","Public health expenditure consists of recurrent and capital spending from government (central and local) budgets, external borrowings and grants (including donations from international agencies and nongovernmental organizations), and social (or compulsory) health insurance funds.","World Health Organization Global Health Expenditure database (see http://apps.who.int/nha/database for the most recent updates)."
SH.XPD.PUBL,"Health expenditure, public (% of total health expenditure)","Public health expenditure consists of recurrent and capital spending from government (central and local) budgets, external borrowings and grants (including donations from international agencies and nongovernmental organizations), and social (or compulsory) health insurance funds. Total health expenditure is the sum of public and private health expenditure. It covers the provision of health services (preventive and curative), family planning activities, nutrition activities, and emergency aid designated for health but does not include provision of water and sanitation.","World Health Organization Global Health Expenditure database (see http://apps.who.int/nha/database for the most recent updates)."
SH.XPD.TOTL.ZS,"Health expenditure, total (% of GDP)","Total health expenditure is the sum of public and private health expenditure. It covers the provision of health services (preventive and curative), family planning activities, nutrition activities, and emergency aid designated for health but does not include provision of water and sanitation.","World Health Organization Global Health Expenditure database (see http://apps.who.int/nha/database for the most recent updates)."
SH.XPD.OOPC.ZS,"Out-of-pocket health expenditure (% of private expenditure on health)","Out of pocket expenditure is any direct outlay by households, including gratuities and in-kind payments, to health practitioners and suppliers of pharmaceuticals, therapeutic appliances, and other goods and services whose primary intent is to contribute to the restoration or enhancement of the health status of individuals or population groups. It is a part of private health expenditure.","World Health Organization Global Health Expenditure database (see http://apps.who.int/nha/database for the most recent updates)."
